<?xml version="1.0" encoding="UTF-8"?>
<schema xmlns="http://www.w3.org/2001/XMLSchema">
    <element name="pontoDeVenda">
      <complexType>
          <sequence>
              <element name="funcionario" type="string"/>
              <element name="horaAberturaCaixa" type="date"/>
              <element name="turno" type="string"/>
              <element name="vlFundCaixa" type="decimal"/>
              <element name = "listaDeProdutos">
                  <complexType>
                      <sequence>
                          <element name="produto">
                              <complexType>
                                  <sequence>
                                      <element name="item" type="int"/>
                                      <element name="descricao" type="string"/>
                                      <element name="valor" type="double"/>
                                      <element name="observacao" type="string"/>
                                  </sequence>
                              </complexType>
                          </element>
                      </sequence>
                  </complexType>
              </element>
          </sequence>
      </complexType>
    </element>


</schema>

